{
  "$schema": "https://json-schema.org/draft/2020-12/schema",
  "$id": "https://echo-guardian.local/schemas/baseline-summary.schema.json",
  "title": "Echo Guardian Baseline Summary v0.2",
  "type": "object",
  "additionalProperties": false,
  "required": [
    "schema_version",
    "baseline_id",
    "created_at",
    "updated_at",
    "status",
    "minimum_observations_for_established",
    "total_observations",
    "spaces",
    "confidence",
    "plain_language_summary",
    "sensitive_details_included",
    "degraded_reason",
    "replaced_from_baseline_id",
    "audit_refs"
  ],
  "properties": {
    "schema_version": { "type": "string", "const": "0.2" },
    "baseline_id": { "type": "string" },
    "created_at": { "type": "string", "format": "date-time" },
    "updated_at": { "type": "string", "format": "date-time" },
    "status": { "type": "string", "enum": ["no_baseline", "learning", "established", "degraded", "reset", "replaced"] },
    "minimum_observations_for_established": { "type": "integer", "minimum": 1 },
    "total_observations": { "type": "integer", "minimum": 0 },
    "spaces": {
      "type": "array",
      "items": {
        "type": "object",
        "additionalProperties": false,
        "required": ["space_id", "private_space", "enabled", "observation_count", "observed_signal_types", "confidence", "last_observed_at", "summary"],
        "properties": {
          "space_id": { "type": "string" },
          "private_space": { "type": "boolean" },
          "enabled": { "type": "boolean" },
          "observation_count": { "type": "integer", "minimum": 0 },
          "observed_signal_types": { "type": "array", "items": { "type": "string" }, "uniqueItems": true },
          "confidence": { "type": "number", "minimum": 0, "maximum": 1 },
          "last_observed_at": { "type": ["string", "null"], "format": "date-time" },
          "summary": { "type": "string" }
        }
      }
    },
    "confidence": {
      "type": "object",
      "additionalProperties": false,
      "required": ["overall", "observation_volume", "space_coverage"],
      "properties": {
        "overall": { "type": "number", "minimum": 0, "maximum": 1 },
        "observation_volume": { "type": "number", "minimum": 0, "maximum": 1 },
        "space_coverage": { "type": "number", "minimum": 0, "maximum": 1 }
      }
    },
    "plain_language_summary": { "type": "string" },
    "sensitive_details_included": { "type": "boolean", "const": false },
    "degraded_reason": { "type": ["string", "null"] },
    "replaced_from_baseline_id": { "type": ["string", "null"] },
    "audit_refs": { "type": "array", "items": { "type": "string" }, "uniqueItems": true }
  }
}
