{"audit_refs":["51f4d856-6244-4cb7-8ba4-ca70fe470af9","c1d66b13-3383-46d1-8e2c-17366152ad26"],"baseline_id":"61e9c69d-9c85-4680-ae31-9192ccf218e2","confidence":{"observation_volume":0.083,"overall":0.396,"space_coverage":0.333},"created_at":"2026-06-23T08:37:03Z","degraded_reason":null,"minimum_observations_for_established":12,"plain_language_summary":"Echo Guardian is learning normal activity patterns from minimized local safety signals. Confidence is 39%.","replaced_from_baseline_id":null,"schema_version":"0.2","sensitive_details_included":false,"spaces":[{"confidence":0.396,"enabled":true,"last_observed_at":"2026-06-23T08:34:25Z","observation_count":1,"observed_signal_types":["motion"],"private_space":false,"space_id":"living_room","summary":"Echo Guardian has learned 1 minimized safety observations; signals: motion; movement has been seen."}],"status":"learning","total_observations":1,"updated_at":"2026-06-23T08:37:03Z"}
